title,author,description,news_category,urlToImage,publishedat,source_id,news_related
"RIP to These NASA X Accounts, as U.S. Science Falls Off a Cliff",Ellyn Lapointe,"While some welcome the change, other experts warn that this move could make it even harder to access scientific information in Trump’s America.",science,https://gizmodo.com/app/uploads/2025/06/NASA-sign-1200x675.jpg,2025-06-11T16:45:51Z,Gizmodo.com,True
Trump's Crackdown on Foreign Student Visas Could Derail Critical AI Research,"Will Knight, Lauren Goode, Kate Knibbs, Louise Matsakis","The US says it will ""aggressively revoke"" Chinese student visas and has paused interviews for all student visa applicants. Experts warn the moves could weaken American leadership in STEM.",science,"https://media.wired.com/photos/68362ed67854ee198fdf8bcb/191:100/w_1280,c_limit/Trump-STEM-Visas-Business-2217166890.jpg",2025-05-29T19:42:30Z,Wired,True
The most powerful laser in the US recently produced 2 quadrillion watts of power,Andrew Liszewski,"The University of Michigan has announced that its Zettawatt-Equivalent Ultrashort pulse laser System (ZEUS) produced 2 petawatts, or 2 quadrillion watts of power during its first experiment. That’s more than “100 times the global electricity power output,” ac…",science,https://platform.theverge.com/wp-content/uploads/sites/2/2025/05/zeuslaser.jpg?quality=90&strip=all&crop=0%2C10.721349621873%2C100%2C78.557300756254&w=1200,2025-05-20T16:47:20Z,The Verge,True
Here's the science behind the COVID vaccine in pregnancy,Jackie Fortiér,Existing evidence on the safety and efficacy of getting a COVID vaccine in pregnancy all points the same way: the shot is important for maternal and fetal health.,science,https://npr.brightspotcdn.com/dims3/default/strip/false/crop/2121x1193+0+110/resize/1400/quality/100/format/jpeg/?url=http%3A%2F%2Fnpr-brightspot.s3.amazonaws.com%2F3a%2F27%2F388d462249b7914509c901a11ac4%2Fgettyimages-1356313576.jpg,2025-05-30T21:14:00Z,NPR,True
"ZEUS Is Officially America’s Most Powerful Laser, With 2-Petawatt Blast",Isaac Schultz,The most powerful laser in the U.S. just fired up to full strength for its first official experiment—and it’s an absolute beast.,science,https://gizmodo.com/app/uploads/2025/05/zeus-laser.jpg,2025-05-20T20:05:24Z,Gizmodo.com,True
"A biotech company sold over 500,000 AI-powered health testing kits. Two C-suite leaders share how they kept science at the center.",amok@insider.com (Aaron Mok),Viome is combining science and AI to provide dietary advice and detect diseases. Two company execs share how they use the MVP mindset for innovation.,science,https://i.insider.com/684c3c2cf748d8c055f3a746?width=1200&format=jpeg,2025-06-17T17:04:48Z,Business Insider,True
Trump Cuts Are Killing a Tiny Office That Keeps Measurements of the World Accurate,Molly Taft,A tiny but crucial agency that maintains physical coordinates like latitude and longitude in the US is struggling as the Trump administration forces out federal employees.,science,"https://media.wired.com/photos/6827affd820db7d753adbb1c/191:100/w_1280,c_limit/GettyImages-1337105596.jpg",2025-05-21T17:00:00Z,Wired,True
Xbox co-founder J Allard is working on ‘breakthrough’ devices at Amazon,Antonio G. Di Benedetto,"Amazon has a new ZeroOne team focused on “breakthrough” devices, and it’s led by Xbox cofounder and former Microsoft executive J Allard, CNBC reports. Based on a job listing for the team, one of those products is a smart home device. J Allard was one of the m…",science,https://platform.theverge.com/wp-content/uploads/sites/2/2025/04/acastro_STK103__01.jpg?quality=90&strip=all&crop=0%2C10.732984293194%2C100%2C78.534031413613&w=1200,2025-05-29T20:09:34Z,The Verge,True
New Supermaterial: As Strong as Steel and as Light as Styrofoam,John Elliot V,Today in material science news we have a report from [German Science Guy] about a new supermaterial which is as strong as steel and as light as Styrofoam! A supermaterial is a type of material that…,science,https://hackaday.com/wp-content/uploads/2025/05/supermaterial-banner.png,2025-05-28T02:00:28Z,Hackaday,True
Retrotechtacular: Arthur C. Clarke Predicts the Future,Al Williams,"Predicting the future is a dangerous occupation. Few people can claim as much success as Arthur C. Clarke, the famous science and science fiction author. Thanks to the BBC and the Australian Broadc…",science,https://hackaday.com/wp-content/uploads/2025/06/clarke_feat.jpg,2025-06-16T17:00:30Z,Hackaday,True
A Game-Changing Telescope Is About to Reveal Its First Images. Here’s How to Watch,Ellyn Lapointe,"The Vera C. Rubin observatory will host a “first look” event at 11 a.m. ET on Monday, June 23. You can watch it live right here.",science,https://gizmodo.com/app/uploads/2025/06/vera-rubin-observatory-1200x675.jpg,2025-06-19T14:00:01Z,Gizmodo.com,True
Haunting Deep-Sea Footage Reveals U.S. Submarine Lost During WWI,Natalia Mesa,"With cutting-edge deep-sea imaging technology, researchers captured high-definition images of a 100-year old submarine.",science,https://gizmodo.com/app/uploads/2025/05/Sunken-USS-F1-Submarine.jpg,2025-05-30T19:35:15Z,Gizmodo.com,True
"Priced out of Austin, he bought a one-way ticket out of the US. Now, he lives on a Thai island for a fraction of the cost.",Amanda Goh,"Despite having a degree in computer science, he struggled to get a job and ended up moving to an island in Thailand.",science,https://i.insider.com/6833fa1c6ffb6822ec61751c?width=1200&format=jpeg,2025-06-02T00:14:01Z,Business Insider,True
The CEO of a multibillion-dollar company says there's one mistake kids make that closes off an entire career path,Nora Redmond,"Giving up studying math and science early on during education closes off a whole swathe of careers, Otis CEO Judy Marks said.",science,https://i.insider.com/683828ebc6ad288d148223f2?width=1200&format=jpeg,2025-05-30T09:30:28Z,Business Insider,True
"With the Switch, technology finally caught up to Nintendo",Jay Peters,"The Nintendo Switch is on the cusp of becoming Nintendo's bestselling hardware ever. In retrospect, it's easy to see why: it's a device that seamlessly transitions from a home console to a handheld, erasing the distinction between the two. It's been so succes…",technology,https://platform.theverge.com/wp-content/uploads/sites/2/2025/05/257766_Nintendo_package__CVirginia_TECH.jpg?quality=90&strip=all&crop=0%2C9.9676601489831%2C100%2C80.064679702034&w=1200,2025-05-27T12:05:37Z,The Verge,True
"After Slashing Thousands of Jobs, Trump’s FDA Wants to Use AI to Rapidly Approve New Drugs",Lucas Ropek,Will more technology make America healthier?,technology,https://gizmodo.com/app/uploads/2024/11/RFK.jpg,2025-06-11T14:55:58Z,Gizmodo.com,True
Haunting Deep-Sea Footage Reveals U.S. Submarine Lost During WWI,Natalia Mesa,"With cutting-edge deep-sea imaging technology, researchers captured high-definition images of a 100-year old submarine.",technology,https://gizmodo.com/app/uploads/2025/05/Sunken-USS-F1-Submarine.jpg,2025-05-30T19:35:15Z,Gizmodo.com,True
"The Samsung 990 PRO 2TB SSD With Heatsink Is Now 45% Off, Amazon Rapidly Sells Through Its Stock",Gizmodo Deals,"This internal SSD with heatsink is a premium option packed with excellent speed, cooling technology and many TB of storage.",technology,https://gizmodo.com/app/uploads/2025/05/samsung-990-pro-ssd-heatsink.jpg,2025-05-30T13:10:31Z,Gizmodo.com,True
"Police must 'do their bit' on funding, minister warns",None,"Science and Technology Secretary Peter Kyle says police should ""embrace change"" as talks over funding continue.",technology,https://ichef.bbci.co.uk/news/1024/branded_news/d396/live/cf5cd850-4456-11f0-bff4-194417507412.jpg,2025-06-08T11:58:29Z,BBC News,True
How 3D-printed guns are spreading online,None,The technology to build your own lethal weapon is promoted on social media,technology,https://ichef.bbci.co.uk/news/1024/branded_news/0307/live/ea26bdf0-4b80-11f0-86d5-3b52b53af158.png,2025-06-19T00:17:34Z,BBC News,True
Futureproof,Jacob Kastrenakes,"AI tools are flooding the culture ecosystem — and no corner of the arts space is immune. In this series, we’re looking at the ways artists are embracing AI, pushing back on it, or trying their best to find an equilibrium with a new technology that’s both swee…",technology,https://platform.theverge.com/wp-content/uploads/sites/2/2025/06/257666_futureproofing_jgibbs-header.jpg?quality=90&strip=all&crop=0%2C10.761835884455%2C100%2C78.47632823109&w=1200,2025-06-18T16:15:59Z,The Verge,True
The Trump administration appears to be planning its own chatbot,Lauren Feiner,"The Trump administration is working on an “AI.gov” website and API to “accelerate government innovation with AI,” 404 Media found based on code posted to Github and an early version of the site. The project appears to be run by the General Services Administra…",technology,https://platform.theverge.com/wp-content/uploads/sites/2/2025/06/STK414_AI_CVIRGINIA_2_C.jpg?quality=90&strip=all&crop=0%2C10.732984293194%2C100%2C78.534031413613&w=1200,2025-06-10T16:55:05Z,The Verge,True
"HP reveals $24,999 hardware created just for Google Beam",Emma Roth,"HP has become the first company to preview hardware built with Google Beam, the 3D video communication technology formerly known as Project Starline. It’s launching the HP Dimension, a device that features a 65-inch light field display with six high-speed cam…",technology,https://platform.theverge.com/wp-content/uploads/sites/2/2025/06/HP-Dimension-with-Google-Beam.jpg?quality=90&strip=all&crop=0%2C15.120008071403%2C100%2C69.759983857194&w=1200,2025-06-10T21:45:48Z,The Verge,True
Clarke’s Law (part 2),Seth Godin,"All sufficiently advanced technology is now widespread. Batman used to have gadgets that gave him an advantage over his adversaries. And Henry Ford had machines that allowed him to produce items far cheaper than the competition. Now, almost all technology mag…",technology,https://seths.blog/wp-content/uploads/2018/06/seth_godin_ogimages_v02_1806137-1.jpg,2025-05-22T09:03:00Z,Seths.blog,True
Apple Releases Safari Technology Preview 220 With Bug Fixes and Performance Improvements,Juli Clover,"Apple today released a new update for Safari Technology Preview, the experimental browser that was first introduced in March 2016. Apple designed ‌Safari Technology Preview‌ to allow users to test features that are planned for future release versions of the S…",technology,https://images.macrumors.com/t/gSfA9gdPJTtAYv_7hjK9YByevcM=/2500x/article-new/2024/07/Safari-Technology-Preview-Updated-Feature-1.jpg,2025-05-28T21:39:58Z,MacRumors,True
Max will show autoplaying video previews picked by AI,Emma Roth,"Max — soon to be called HBO Max again — is rolling out an update that automatically plays video previews when you hover over shows and movies. The video previews are launching to users in the US now, but Max is still working on an “AI-assisted” tool to pick t…",technology,https://platform.theverge.com/wp-content/uploads/sites/2/2025/06/Preview-Rail_Hacks.png?quality=90&strip=all&crop=0%2C0%2C94.061083621892%2C87.549447353112&w=1200,2025-06-17T16:18:02Z,The Verge,True
Jony Ive’s OpenAI device gets the Powell Jobs nod of approval,Jess Weatherbed,"The mysterious AI gadget being created by OpenAI and former Apple design chief Jony Ive has been given the thumbs up from Laurene Powell Jobs. In a new interview published by The Financial Times, the two reminisce about Jony Ive’s time working at Apple alongs…",technology,https://platform.theverge.com/wp-content/uploads/sites/2/2025/06/gettyimages-1438500402.jpg?quality=90&strip=all&crop=0%2C10.729474235474%2C100%2C78.541051529051&w=1200,2025-06-02T10:33:58Z,The Verge,True
OpenAI awarded $200 million US defense contract,Jess Weatherbed,"OpenAI is officially on the Pentagon’s payroll. The Department of Defence announced a $200 million contract with OpenAI to provide the US government with new artificial intelligence tools, including those used for proactive cyber defense. In a post outlining …",technology,https://platform.theverge.com/wp-content/uploads/sites/2/2025/02/STK155_OPEN_AI_2025_CVirgiia_C.jpg?quality=90&strip=all&crop=0%2C10.732984293194%2C100%2C78.534031413613&w=1200,2025-06-17T09:35:46Z,The Verge,True
Apple Releases Safari Technology Preview 221 With Bug Fixes and Performance Improvements,Juli Clover,"Apple today released a new update for Safari Technology Preview, the experimental browser that was first introduced in March 2016. Apple designed ‌Safari Technology Preview‌ to allow users to test features that are planned for future release versions of the S…",technology,https://images.macrumors.com/t/gSfA9gdPJTtAYv_7hjK9YByevcM=/2500x/article-new/2024/07/Safari-Technology-Preview-Updated-Feature-1.jpg,2025-06-11T22:30:48Z,MacRumors,True
"Tariffs, Technology, and the New Geography of Manufacturing","Daniel Kuepper, Nikolaus Lang, Jan Nordemann",How to know when—and where—to relocate production.,technology,https://hbr.org/resources/images/article_assets/2025/05/May25_29_BarbaraGibson.jpg,2025-06-02T12:05:32Z,Harvard Business Review,True
Adding Assistive Technology to a Doorbell,Bryan Cockfield,"The advent of affordable computing over the last few decades has certainly been a boon for many people with disabilities, making it easier to access things like text-to-speech technology, automation, …read more",technology,https://hackaday.com/wp-content/uploads/2025/05/doorbell-attiny-main.jpg,2025-06-04T20:00:00Z,Hackaday,True
"PCIe 7.0 is coming, but not soon, and not for you",Jess Weatherbed,"The PCIe 7.0 specification has now been released, while many of us are still waiting for PCIe 6.0 to materialize in consumer products. The PCI Special Interest Group (PCI-SIG) announced on Wednesday that PCIe 7.0 is now available to members of its organizatio…",technology,https://platform.theverge.com/wp-content/uploads/sites/2/2025/03/STKS505_QUANTUM_COMPUTING_A.jpg?quality=90&strip=all&crop=0%2C10.732984293194%2C100%2C78.534031413613&w=1200,2025-06-13T09:22:06Z,The Verge,True
Latent Technology raises $8M to change animation with generative physics,Dean Takahashi,"Latent Technology, a game technology company focused on AI-driven physical animation, has closed an $8 million seed funding round.",technology,https://venturebeat.com/wp-content/uploads/2025/06/latent-2.jpg?w=1024?w=1200&strip=all,2025-06-05T13:30:00Z,VentureBeat,True
Best eSIM-compatible Android phones 2025,"patrick.farmer@futurenet.com (Patrick Farmer) , Patrick Farmer","It's pretty common for new Android phones to use eSIM technology, but which devices are the best?",technology,https://cdn.mos.cms.futurecdn.net/xETzw2tvXYbiYMQtZhF9SV.jpg,2025-06-04T15:21:58Z,Android Central,True